{
  "schema_version": 1,
  "run_id": "963b69750ab8dca9",
  "params_hash": "aa7fee04",
  "submitted_at": "2026-06-16T23:26:24Z",
  "querygym_version": "0.1.0",
  "environment": {
    "python_version": "3.12.13",
    "platform": "Linux-x86_64",
    "git_commit": null
  },
  "pipeline": {
    "dataset_id": "bright-robotics",
    "method_id": "query2doc",
    "model": "openai/gpt-4.1",
    "steps_completed": [
      "reformulate",
      "retrieve",
      "evaluate"
    ],
    "total_time_seconds": 251.9719705581665
  },
  "config": {
    "method_params": {
      "mode": "zs"
    },
    "llm_config": {
      "temperature": 1.0,
      "max_tokens": 128
    },
    "dataset_config": {
      "topics": "bright-robotics",
      "index": "bright-robotics",
      "num_queries": 101
    },
    "retrieval": {
      "retriever_id": "bm25",
      "paradigm": "lexical",
      "params": {
        "k1": 0.9,
        "b": 0.4
      },
      "implementation": "pyserini:LuceneSearcher"
    }
  },
  "metrics": {
    "ndcg_cut_10": 0.1255,
    "recall_100": 0.4058
  },
  "timing": {
    "reformulation_seconds": 236.385977268219,
    "retrieval_seconds": 2.0705811977386475,
    "evaluation_seconds": 12.545291185379028
  },
  "artifacts": {
    "run_file": "aa7fee04.run.txt",
    "reformulated_queries": "aa7fee04.queries.tsv"
  }
}
