{
  "schema_version": 1,
  "run_id": "e923c0d8f7330e38",
  "params_hash": "ac7a6551",
  "submitted_at": "2026-06-16T23:26:21Z",
  "querygym_version": "0.1.0",
  "environment": {
    "python_version": "3.12.13",
    "platform": "Linux-x86_64",
    "git_commit": null
  },
  "pipeline": {
    "dataset_id": "bright-psychology",
    "method_id": "mugi",
    "model": "openai/gpt-4.1",
    "steps_completed": [
      "reformulate",
      "retrieve",
      "evaluate"
    ],
    "total_time_seconds": 1010.047336101532
  },
  "config": {
    "method_params": {},
    "llm_config": {
      "temperature": 1.0,
      "max_tokens": 128
    },
    "dataset_config": {
      "topics": "bright-psychology",
      "index": "bright-psychology",
      "num_queries": 101
    },
    "retrieval": {
      "retriever_id": "bm25",
      "paradigm": "lexical",
      "params": {
        "k1": 0.9,
        "b": 0.4
      },
      "implementation": "pyserini:LuceneSearcher"
    }
  },
  "metrics": {
    "ndcg_cut_10": 0.4078,
    "recall_100": 0.7022
  },
  "timing": {
    "reformulation_seconds": 993.8295125961304,
    "retrieval_seconds": 2.441349506378174,
    "evaluation_seconds": 12.886282444000244
  },
  "artifacts": {
    "run_file": "ac7a6551.run.txt",
    "reformulated_queries": "ac7a6551.queries.tsv"
  }
}
