{
  "schema_version": 1,
  "run_id": "034c2f04fbb891e0",
  "params_hash": "5ea0f26f",
  "submitted_at": "2026-06-16T23:26:22Z",
  "querygym_version": "0.1.0",
  "environment": {
    "python_version": "3.12.13",
    "platform": "Linux-x86_64",
    "git_commit": null
  },
  "pipeline": {
    "dataset_id": "bright-economics",
    "method_id": "query2doc",
    "model": "openai/gpt-4.1",
    "steps_completed": [
      "reformulate",
      "retrieve",
      "evaluate"
    ],
    "total_time_seconds": 259.2823107242584
  },
  "config": {
    "method_params": {
      "mode": "cot"
    },
    "llm_config": {
      "temperature": 1.0,
      "max_tokens": 128
    },
    "dataset_config": {
      "topics": "bright-economics",
      "index": "bright-economics",
      "num_queries": 103
    },
    "retrieval": {
      "retriever_id": "bm25",
      "paradigm": "lexical",
      "params": {
        "k1": 0.9,
        "b": 0.4
      },
      "implementation": "pyserini:LuceneSearcher"
    }
  },
  "metrics": {
    "ndcg_cut_10": 0.1843,
    "recall_100": 0.4504
  },
  "timing": {
    "reformulation_seconds": 243.26867485046387,
    "retrieval_seconds": 2.070296287536621,
    "evaluation_seconds": 13.038284063339233
  },
  "artifacts": {
    "run_file": "5ea0f26f.run.txt",
    "reformulated_queries": "5ea0f26f.queries.tsv"
  }
}
