{
  "schema_version": 1,
  "run_id": "a7b97c9d8e91e0e3",
  "params_hash": "edce8c2a",
  "submitted_at": "2026-06-16T23:26:24Z",
  "querygym_version": "0.1.0",
  "environment": {
    "python_version": "3.12.13",
    "platform": "Linux-x86_64",
    "git_commit": null
  },
  "pipeline": {
    "dataset_id": "bright-economics",
    "method_id": "query2e",
    "model": "openai/gpt-4.1",
    "steps_completed": [
      "reformulate",
      "retrieve",
      "evaluate"
    ],
    "total_time_seconds": 236.48807907104492
  },
  "config": {
    "method_params": {},
    "llm_config": {
      "temperature": 1.0,
      "max_tokens": 128
    },
    "dataset_config": {
      "topics": "bright-economics",
      "index": "bright-economics",
      "num_queries": 103
    },
    "retrieval": {
      "retriever_id": "bm25",
      "paradigm": "lexical",
      "params": {
        "k1": 0.9,
        "b": 0.4
      },
      "implementation": "pyserini:LuceneSearcher"
    }
  },
  "metrics": {
    "ndcg_cut_10": 0.1812,
    "recall_100": 0.4312
  },
  "timing": {
    "reformulation_seconds": 220.36924147605896,
    "retrieval_seconds": 1.9922451972961426,
    "evaluation_seconds": 12.991879940032959
  },
  "artifacts": {
    "run_file": "edce8c2a.run.txt",
    "reformulated_queries": "edce8c2a.queries.tsv"
  }
}
