{
  "schema_version": 1,
  "run_id": "3e38494840a3c001",
  "params_hash": "bb1e250c",
  "submitted_at": "2026-06-16T23:26:19Z",
  "querygym_version": "0.1.0",
  "environment": {
    "python_version": "3.12.13",
    "platform": "Linux-x86_64",
    "git_commit": null
  },
  "pipeline": {
    "dataset_id": "bright-sustainable-living",
    "method_id": "genqr",
    "model": "openai/gpt-4.1",
    "steps_completed": [
      "reformulate",
      "retrieve",
      "evaluate"
    ],
    "total_time_seconds": 1015.8413503170013
  },
  "config": {
    "method_params": {},
    "llm_config": {
      "temperature": 1.0,
      "max_tokens": 128
    },
    "dataset_config": {
      "topics": "bright-sustainable-living",
      "index": "bright-sustainable-living",
      "num_queries": 108
    },
    "retrieval": {
      "retriever_id": "bm25",
      "paradigm": "lexical",
      "params": {
        "k1": 0.9,
        "b": 0.4
      },
      "implementation": "pyserini:LuceneSearcher"
    }
  },
  "metrics": {
    "ndcg_cut_10": 0.1419,
    "recall_100": 0.5423
  },
  "timing": {
    "reformulation_seconds": 998.4915895462036,
    "retrieval_seconds": 2.358976125717163,
    "evaluation_seconds": 14.07237696647644
  },
  "artifacts": {
    "run_file": "bb1e250c.run.txt",
    "reformulated_queries": "bb1e250c.queries.tsv"
  }
}
