{
  "schema_version": 1,
  "run_id": "d95ebcd0babc045c",
  "params_hash": "1b16c47d",
  "submitted_at": "2026-06-18T01:34:38Z",
  "querygym_version": "0.1.0",
  "environment": {
    "python_version": "3.12.13",
    "platform": "Linux-5.15.0-181-generic-x86_64-with-glibc2.35",
    "git_commit": "de255bd"
  },
  "pipeline": {
    "dataset_id": "bright-stackoverflow",
    "method_id": "query2doc",
    "model": "openai/gpt-4.1",
    "steps_completed": [
      "reformulate",
      "retrieve",
      "evaluate"
    ],
    "total_time_seconds": 211.57536935806274
  },
  "config": {
    "method_params": {
      "mode": "fs",
      "num_examples": 4,
      "collection_path": "stackoverflow/collection.tsv",
      "train_queries_path": "stackoverflow/train_queries.tsv",
      "train_qrels_path": "stackoverflow/train_qrels.txt",
      "dataset_type": "generic"
    },
    "llm_config": {
      "temperature": 1.0,
      "max_tokens": 128
    },
    "dataset_config": {
      "topics": "bright-stackoverflow",
      "index": "bright-stackoverflow",
      "num_queries": 117
    },
    "retrieval": {
      "retriever_id": "bm25",
      "paradigm": "lexical",
      "params": {
        "k1": 0.9,
        "b": 0.4
      },
      "implementation": "pyserini:LuceneSearcher"
    }
  },
  "metrics": {
    "ndcg_cut_10": 0.1813,
    "recall_100": 0.4474
  },
  "timing": {
    "reformulation_seconds": 195.0482861995697,
    "retrieval_seconds": 2.699096202850342,
    "evaluation_seconds": 13.8279869556427
  },
  "artifacts": {
    "run_file": "1b16c47d.run.txt",
    "reformulated_queries": "1b16c47d.queries.tsv"
  }
}
