{
  "schema_version": 1,
  "run_id": "f7056b100e431026",
  "params_hash": "ac7a6551",
  "submitted_at": "2026-06-16T23:26:21Z",
  "querygym_version": "0.1.0",
  "environment": {
    "python_version": "3.12.13",
    "platform": "Linux-x86_64",
    "git_commit": null
  },
  "pipeline": {
    "dataset_id": "bright-sustainable-living",
    "method_id": "mugi",
    "model": "openai/gpt-4.1",
    "steps_completed": [
      "reformulate",
      "retrieve",
      "evaluate"
    ],
    "total_time_seconds": 1077.4348757266998
  },
  "config": {
    "method_params": {},
    "llm_config": {
      "temperature": 1.0,
      "max_tokens": 128
    },
    "dataset_config": {
      "topics": "bright-sustainable-living",
      "index": "bright-sustainable-living",
      "num_queries": 108
    },
    "retrieval": {
      "retriever_id": "bm25",
      "paradigm": "lexical",
      "params": {
        "k1": 0.9,
        "b": 0.4
      },
      "implementation": "pyserini:LuceneSearcher"
    }
  },
  "metrics": {
    "ndcg_cut_10": 0.2685,
    "recall_100": 0.6485
  },
  "timing": {
    "reformulation_seconds": 1060.7829661369324,
    "retrieval_seconds": 2.359484910964966,
    "evaluation_seconds": 13.369176387786865
  },
  "artifacts": {
    "run_file": "ac7a6551.run.txt",
    "reformulated_queries": "ac7a6551.queries.tsv"
  }
}
